{
  "summary": "BTC/USDT 4h: bullish momentum confirmed by MACD positive crossover + price above 50EMA, but RSI 73 is overbought territory. TimesFM projects mild upward continuation, news sentiment net positive (ETF inflow narrative). Edge is real but small — favor LONG with modest size and tight stop.",
  "global_confidence": 0.58,
  "choice_assessments": [
    {
      "label": "LONG",
      "probability": 0.56,
      "confidence": 0.61,
      "evidence": {
        "reliability": 0.78,
        "diversity": 0.69,
        "recency": 0.95,
        "overall_strength": 0.74
      },
      "data_coverage": 0.82,
      "contradictions": [
        "RSI 73 historically precedes mean-reversion within 24h ~38% of the time on this pair."
      ],
      "key_points": [
        "MACD crossed positive at 14:00 UTC, confirmed by 4h close above 50EMA at 67400.",
        "TimesFM 24h forecast +1.2% with confidence interval [-0.4, +2.8].",
        "Net spot ETF inflow $214M past 48h (Farside data) — positive sentiment driver.",
        "Open interest up 8% past 12h with funding rate still under 0.012% — not over-leveraged yet."
      ]
    },
    {
      "label": "SHORT",
      "probability": 0.24,
      "confidence": 0.42,
      "evidence": {
        "reliability": 0.65,
        "diversity": 0.58,
        "recency": 0.91,
        "overall_strength": 0.60
      },
      "data_coverage": 0.70,
      "contradictions": [
        "Macro tailwind (DXY weak, gold rising) supports risk-on, contradicting short setup."
      ],
      "key_points": [
        "RSI overbought + bearish hidden divergence on 1h.",
        "Resistance cluster at 68200 (prior swing high + 0.618 fib).",
        "Whale wallet aggregate +2.4k BTC into Coinbase past 6h — possible distribution signal."
      ]
    },
    {
      "label": "HOLD",
      "probability": 0.20,
      "confidence": 0.55,
      "evidence": {
        "reliability": 0.72,
        "diversity": 0.60,
        "recency": 0.95,
        "overall_strength": 0.68
      },
      "data_coverage": 0.85,
      "contradictions": [],
      "key_points": [
        "Strong setup either direction is borderline — within current position bands, no action may be highest-EV.",
        "Macro event risk (FOMC minutes 19:00 UTC tomorrow) suggests pre-event flat is reasonable.",
        "Implied vol on dated options spiked +12% — market pricing in event move."
      ]
    }
  ],
  "uncertainty_flags": [
    "high_disagreement"
  ],
  "trade_blockers": [],
  "rationale": "Step 1 — Multi-timeframe scan: 4h chart bullish (MACD positive cross, price > 50EMA, higher highs since 65800 low). 1h chart shows hidden bearish divergence and RSI in 73 overbought zone. Daily chart range-bound 66k-69k for 9 days — trending sideways at higher level.\n\nStep 2 — Forecasting model input: TimesFM (4h horizon, 96-step lookback) projects +1.2% over next 24h, confidence interval includes zero crossing. Modest bullish bias, not high-conviction.\n\nStep 3 — On-chain signals: Net ETF inflow $214M positive. Coinbase whale inflows +2.4k BTC contradicting bullish thesis — possible distribution before FOMC.\n\nStep 4 — Sentiment & macro: DXY at 103.4 (weak), gold at $2680 (strong), US10Y at 4.18% (stable). Net risk-on environment supports crypto LONG.\n\nStep 5 — Microstructure: Bid-ask spread tight (0.4 bps on Binance USDT-M perp), exit liquidity within 0.5% = $8.2M aggregate top-of-book. No microstructure blockers.\n\nStep 6 — Probability synthesis: LONG win condition (>+0.5% in next 24h): 0.56. SHORT (<-0.5% in 24h): 0.24. HOLD (-0.5 to +0.5% range): 0.20.\n\nStep 7 — Position sizing implication: edge is real but modest (LONG EV ~+0.32% expected return). With FOMC in 24h and RSI overbought, sizing should be conservative — 0.5x normal Kelly. Stop-loss at 67000 (-0.6%, below MACD line and 50EMA). high_disagreement flag raised because committee was not unanimous and contradictions cluster around overbought signal vs trend continuation thesis.",
  "crypto_extension": {
    "symbol": "BTC/USDT",
    "interval": "4h",
    "timefm_score": 0.42,
    "news_score": 0.31
  }
}
